{
  "$schema": "http://json-schema.org/draft-06/schema#",
  "$id": "https://distanthorizon.dev/schemas/world.schema.json",
  "title": "World document",
  "description": "One star system (star, planets, stations), loaded at server startup. Derived from the Gleam decoders in server/src/dh_server/world.gleam (world_decoder/station_decoder/body_decoder/commodity_decoder/market_entry_decoder/orbit_decoder) and server/src/dh_server/deckplan.gleam (decoder) — those decoders are the source of truth; this schema is documentation and a typo-catcher, not a substitute for them. additionalProperties is false at every object level even though the decoders themselves ignore unknown fields, precisely so this schema can catch typos the decoders would silently swallow. Note: every field typed 'number' here backs a Gleam decode.float field, which REJECTS bare JSON integers (e.g. 5 is invalid, 5.0 is required) — JSON Schema draft 2020-12 cannot distinguish 1 from 1.0, so that constraint is documented here rather than enforced.",
  "type": "object",
  "additionalProperties": false,
  "required": ["schema", "name", "seed", "bodies", "stations", "spawn_station"],
  "properties": {
    "schema": { "type": "integer" },
    "name": { "type": "string" },
    "seed": { "type": "integer" },
    "commodities": {
      "type": "array",
      "description": "Optional field (decode.optional_field, default []).",
      "items": { "$ref": "#/$defs/commodity" }
    },
    "bodies": {
      "type": "array",
      "items": { "$ref": "#/$defs/body" }
    },
    "stations": {
      "type": "array",
      "items": { "$ref": "#/$defs/station" }
    },
    "spawn_station": {
      "type": "string",
      "description": "Must reference an existing station id (enforced by the Gleam decoder's validate step, not by this schema)."
    }
  },
  "$defs": {
    "orbit": {
      "type": "object",
      "additionalProperties": false,
      "required": ["radius", "period_s", "phase"],
      "properties": {
        "radius": {
          "type": "number",
          "description": "decode.float: JSON value must have a decimal point (e.g. 4000.0), a bare integer is rejected."
        },
        "period_s": {
          "type": "number",
          "description": "decode.float: JSON value must have a decimal point, a bare integer is rejected."
        },
        "phase": {
          "type": "number",
          "description": "decode.float: JSON value must have a decimal point, a bare integer is rejected."
        }
      }
    },
    "body": {
      "type": "object",
      "additionalProperties": false,
      "required": ["id", "name", "kind", "parent", "orbit", "radius", "mu"],
      "properties": {
        "id": { "type": "string" },
        "name": { "type": "string" },
        "kind": {
          "type": "string",
          "description": "Free-form in the decoder (no enum, e.g. \"star\"/\"planet\" are conventions, not constraints); left open here."
        },
        "parent": {
          "type": ["string", "null"],
          "description": "decode.field + decode.optional: the key is required, but its value may be null (no parent, e.g. the star) or a body id string."
        },
        "orbit": {
          "description": "decode.field + decode.optional: the key is required, but its value may be null (no orbit, e.g. the star) or an orbit object.",
          "oneOf": [
            { "type": "null" },
            { "$ref": "#/$defs/orbit" }
          ]
        },
        "radius": {
          "type": "number",
          "description": "decode.float: JSON value must have a decimal point, a bare integer is rejected."
        },
        "mu": {
          "type": "number",
          "description": "decode.float: JSON value must have a decimal point, a bare integer is rejected."
        }
      }
    },
    "commodity": {
      "type": "object",
      "additionalProperties": false,
      "required": ["id", "name"],
      "properties": {
        "id": { "type": "string" },
        "name": { "type": "string" }
      }
    },
    "market_entry": {
      "type": "object",
      "additionalProperties": false,
      "required": ["commodity", "initial", "price", "elasticity"],
      "properties": {
        "commodity": {
          "type": "string",
          "description": "Must reference an existing commodity id (enforced by the Gleam decoder's validate step, not by this schema)."
        },
        "initial": { "type": "integer" },
        "price": { "type": "integer" },
        "elasticity": { "type": "integer" }
      }
    },
    "station": {
      "type": "object",
      "additionalProperties": false,
      "required": ["id", "name", "class", "parent", "orbit"],
      "description": "A world station instance: per-instance placement/economy plus a `class` reference (issue #30). dock_radius/crane/concourse come from the referenced station class, and berths derive from that concourse's q glyphs (issue #31) — none of them live here.",
      "properties": {
        "id": { "type": "string" },
        "name": { "type": "string" },
        "class": {
          "type": "string",
          "description": "References a station class id under server/stationclasses/ (resolved by the Gleam decoder; an unknown id is rejected there, not by this schema)."
        },
        "parent": {
          "type": "string",
          "description": "Must reference an existing body id (enforced by the Gleam decoder's validate step, not by this schema)."
        },
        "orbit": { "$ref": "#/$defs/orbit" },
        "market": {
          "type": "array",
          "description": "Optional field (decode.optional_field, default []). Per-instance trade terms.",
          "items": { "$ref": "#/$defs/market_entry" }
        }
      }
    },
    "deck": {
      "type": "object",
      "additionalProperties": false,
      "required": ["name", "grid"],
      "properties": {
        "name": { "type": "string" },
        "grid": {
          "type": "array",
          "description": "3*height rows of 3*width chars: each tile is a 3x3 block (centre = floor/void/stairs; N/E/S/W edge-mids = wall/door/fixture). See docs/deckplan-format.md.",
          "items": { "type": "string" }
        }
      }
    },
    "console": {
      "type": "object",
      "additionalProperties": false,
      "required": ["id", "kind", "x", "y"],
      "properties": {
        "id": { "type": "string" },
        "kind": {
          "type": "string",
          "description": "Free-form in the decoder (e.g. \"helm\"/\"cargo\"/\"broker\" are conventions, not constraints); left open here."
        },
        "deck": {
          "type": "integer",
          "description": "Which deck index this console sits on (default 0)."
        },
        "x": { "type": "integer" },
        "y": { "type": "integer" }
      }
    },
    "spawn": {
      "type": "object",
      "additionalProperties": false,
      "required": ["tile"],
      "properties": {
        "deck": {
          "type": "integer",
          "description": "Which deck arriving characters appear on (default 0)."
        },
        "tile": {
          "type": "array",
          "description": "[x, y] tile where arriving characters appear.",
          "items": { "type": "integer" },
          "minItems": 2,
          "maxItems": 2
        }
      }
    },
    "deckplan": {
      "type": "object",
      "additionalProperties": false,
      "required": ["decks"],
      "properties": {
        "decks": {
          "type": "array",
          "items": { "$ref": "#/$defs/deck" }
        },
        "consoles": {
          "type": "array",
          "description": "Optional. Authored as center glyphs (h/c/b/q) and derived at load; the server re-emits it (namespaced) over the wire.",
          "items": { "$ref": "#/$defs/console" }
        },
        "spawn": { "$ref": "#/$defs/spawn" }
      }
    }
  }
}
